{
  "code_eval_hash": "7cb6a35291e1204ecf9ee5f6fa19ebbb27d457e02b7814afd0100f05b8801ebf",
  "dataset_hash": "0c837864750b30d97f545010c763f2540086d545922b515923c684cae57b66ac",
  "judge_scores": [
    {
      "case_id": "phase02-006",
      "code_eval_hash": "7cb6a35291e1204ecf9ee5f6fa19ebbb27d457e02b7814afd0100f05b8801ebf",
      "dataset_hash": "0c837864750b30d97f545010c763f2540086d545922b515923c684cae57b66ac",
      "rubric_version": "phase02-rubric.v1",
      "score": 4
    },
    {
      "case_id": "phase02-007",
      "code_eval_hash": "7cb6a35291e1204ecf9ee5f6fa19ebbb27d457e02b7814afd0100f05b8801ebf",
      "dataset_hash": "0c837864750b30d97f545010c763f2540086d545922b515923c684cae57b66ac",
      "rubric_version": "phase02-rubric.v1",
      "score": 4
    },
    {
      "case_id": "phase02-008",
      "code_eval_hash": "7cb6a35291e1204ecf9ee5f6fa19ebbb27d457e02b7814afd0100f05b8801ebf",
      "dataset_hash": "0c837864750b30d97f545010c763f2540086d545922b515923c684cae57b66ac",
      "rubric_version": "phase02-rubric.v1",
      "score": 4
    },
    {
      "case_id": "phase02-009",
      "code_eval_hash": "7cb6a35291e1204ecf9ee5f6fa19ebbb27d457e02b7814afd0100f05b8801ebf",
      "dataset_hash": "0c837864750b30d97f545010c763f2540086d545922b515923c684cae57b66ac",
      "rubric_version": "phase02-rubric.v1",
      "score": 4
    },
    {
      "case_id": "phase02-010",
      "code_eval_hash": "7cb6a35291e1204ecf9ee5f6fa19ebbb27d457e02b7814afd0100f05b8801ebf",
      "dataset_hash": "0c837864750b30d97f545010c763f2540086d545922b515923c684cae57b66ac",
      "rubric_version": "phase02-rubric.v1",
      "score": 4
    }
  ],
  "reviewers": [
    {
      "pseudonym": "yu-nutritionist",
      "role": "nutritionist"
    },
    {
      "pseudonym": "chen-food-data-admin",
      "role": "food_composition_data_steward"
    }
  ],
  "reviews": [
    {
      "case_id": "phase02-001",
      "code_eval_hash": "7cb6a35291e1204ecf9ee5f6fa19ebbb27d457e02b7814afd0100f05b8801ebf",
      "confirmations": {
        "authoritative_values": true,
        "blocking_fields": true,
        "food_code": true,
        "hard_validation": true,
        "household_portion_auditability": true
      },
      "dataset_hash": "0c837864750b30d97f545010c763f2540086d545922b515923c684cae57b66ac",
      "pseudonym": "yu-nutritionist",
      "role": "nutritionist",
      "rubric_version": "phase02-rubric.v1"
    },
    {
      "case_id": "phase02-001",
      "code_eval_hash": "7cb6a35291e1204ecf9ee5f6fa19ebbb27d457e02b7814afd0100f05b8801ebf",
      "confirmations": {
        "authoritative_values": true,
        "blocking_fields": true,
        "food_code": true,
        "hard_validation": true,
        "household_portion_auditability": true
      },
      "dataset_hash": "0c837864750b30d97f545010c763f2540086d545922b515923c684cae57b66ac",
      "pseudonym": "chen-food-data-admin",
      "role": "food_composition_data_steward",
      "rubric_version": "phase02-rubric.v1"
    },
    {
      "case_id": "phase02-002",
      "code_eval_hash": "7cb6a35291e1204ecf9ee5f6fa19ebbb27d457e02b7814afd0100f05b8801ebf",
      "confirmations": {
        "authoritative_values": true,
        "blocking_fields": true,
        "food_code": true,
        "hard_validation": true,
        "household_portion_auditability": true
      },
      "dataset_hash": "0c837864750b30d97f545010c763f2540086d545922b515923c684cae57b66ac",
      "pseudonym": "yu-nutritionist",
      "role": "nutritionist",
      "rubric_version": "phase02-rubric.v1"
    },
    {
      "case_id": "phase02-002",
      "code_eval_hash": "7cb6a35291e1204ecf9ee5f6fa19ebbb27d457e02b7814afd0100f05b8801ebf",
      "confirmations": {
        "authoritative_values": true,
        "blocking_fields": true,
        "food_code": true,
        "hard_validation": true,
        "household_portion_auditability": true
      },
      "dataset_hash": "0c837864750b30d97f545010c763f2540086d545922b515923c684cae57b66ac",
      "pseudonym": "chen-food-data-admin",
      "role": "food_composition_data_steward",
      "rubric_version": "phase02-rubric.v1"
    },
    {
      "case_id": "phase02-003",
      "code_eval_hash": "7cb6a35291e1204ecf9ee5f6fa19ebbb27d457e02b7814afd0100f05b8801ebf",
      "confirmations": {
        "authoritative_values": true,
        "blocking_fields": true,
        "food_code": true,
        "hard_validation": true,
        "household_portion_auditability": true
      },
      "dataset_hash": "0c837864750b30d97f545010c763f2540086d545922b515923c684cae57b66ac",
      "pseudonym": "yu-nutritionist",
      "role": "nutritionist",
      "rubric_version": "phase02-rubric.v1"
    },
    {
      "case_id": "phase02-003",
      "code_eval_hash": "7cb6a35291e1204ecf9ee5f6fa19ebbb27d457e02b7814afd0100f05b8801ebf",
      "confirmations": {
        "authoritative_values": true,
        "blocking_fields": true,
        "food_code": true,
        "hard_validation": true,
        "household_portion_auditability": true
      },
      "dataset_hash": "0c837864750b30d97f545010c763f2540086d545922b515923c684cae57b66ac",
      "pseudonym": "chen-food-data-admin",
      "role": "food_composition_data_steward",
      "rubric_version": "phase02-rubric.v1"
    },
    {
      "case_id": "phase02-004",
      "code_eval_hash": "7cb6a35291e1204ecf9ee5f6fa19ebbb27d457e02b7814afd0100f05b8801ebf",
      "confirmations": {
        "authoritative_values": true,
        "blocking_fields": true,
        "food_code": true,
        "hard_validation": true,
        "household_portion_auditability": true
      },
      "dataset_hash": "0c837864750b30d97f545010c763f2540086d545922b515923c684cae57b66ac",
      "pseudonym": "yu-nutritionist",
      "role": "nutritionist",
      "rubric_version": "phase02-rubric.v1"
    },
    {
      "case_id": "phase02-004",
      "code_eval_hash": "7cb6a35291e1204ecf9ee5f6fa19ebbb27d457e02b7814afd0100f05b8801ebf",
      "confirmations": {
        "authoritative_values": true,
        "blocking_fields": true,
        "food_code": true,
        "hard_validation": true,
        "household_portion_auditability": true
      },
      "dataset_hash": "0c837864750b30d97f545010c763f2540086d545922b515923c684cae57b66ac",
      "pseudonym": "chen-food-data-admin",
      "role": "food_composition_data_steward",
      "rubric_version": "phase02-rubric.v1"
    },
    {
      "case_id": "phase02-005",
      "code_eval_hash": "7cb6a35291e1204ecf9ee5f6fa19ebbb27d457e02b7814afd0100f05b8801ebf",
      "confirmations": {
        "authoritative_values": true,
        "blocking_fields": true,
        "food_code": true,
        "hard_validation": true,
        "household_portion_auditability": true
      },
      "dataset_hash": "0c837864750b30d97f545010c763f2540086d545922b515923c684cae57b66ac",
      "pseudonym": "yu-nutritionist",
      "role": "nutritionist",
      "rubric_version": "phase02-rubric.v1"
    },
    {
      "case_id": "phase02-005",
      "code_eval_hash": "7cb6a35291e1204ecf9ee5f6fa19ebbb27d457e02b7814afd0100f05b8801ebf",
      "confirmations": {
        "authoritative_values": true,
        "blocking_fields": true,
        "food_code": true,
        "hard_validation": true,
        "household_portion_auditability": true
      },
      "dataset_hash": "0c837864750b30d97f545010c763f2540086d545922b515923c684cae57b66ac",
      "pseudonym": "chen-food-data-admin",
      "role": "food_composition_data_steward",
      "rubric_version": "phase02-rubric.v1"
    },
    {
      "case_id": "phase02-006",
      "code_eval_hash": "7cb6a35291e1204ecf9ee5f6fa19ebbb27d457e02b7814afd0100f05b8801ebf",
      "confirmations": {
        "authoritative_values": true,
        "blocking_fields": true,
        "food_code": true,
        "hard_validation": true,
        "household_portion_auditability": true
      },
      "dataset_hash": "0c837864750b30d97f545010c763f2540086d545922b515923c684cae57b66ac",
      "medium_human_score": 5,
      "pseudonym": "yu-nutritionist",
      "role": "nutritionist",
      "rubric_version": "phase02-rubric.v1"
    },
    {
      "case_id": "phase02-006",
      "code_eval_hash": "7cb6a35291e1204ecf9ee5f6fa19ebbb27d457e02b7814afd0100f05b8801ebf",
      "confirmations": {
        "authoritative_values": true,
        "blocking_fields": true,
        "food_code": true,
        "hard_validation": true,
        "household_portion_auditability": true
      },
      "dataset_hash": "0c837864750b30d97f545010c763f2540086d545922b515923c684cae57b66ac",
      "medium_human_score": 5,
      "pseudonym": "chen-food-data-admin",
      "role": "food_composition_data_steward",
      "rubric_version": "phase02-rubric.v1"
    },
    {
      "case_id": "phase02-007",
      "code_eval_hash": "7cb6a35291e1204ecf9ee5f6fa19ebbb27d457e02b7814afd0100f05b8801ebf",
      "confirmations": {
        "authoritative_values": true,
        "blocking_fields": true,
        "food_code": true,
        "hard_validation": true,
        "household_portion_auditability": true
      },
      "dataset_hash": "0c837864750b30d97f545010c763f2540086d545922b515923c684cae57b66ac",
      "medium_human_score": 4,
      "pseudonym": "yu-nutritionist",
      "role": "nutritionist",
      "rubric_version": "phase02-rubric.v1"
    },
    {
      "case_id": "phase02-007",
      "code_eval_hash": "7cb6a35291e1204ecf9ee5f6fa19ebbb27d457e02b7814afd0100f05b8801ebf",
      "confirmations": {
        "authoritative_values": true,
        "blocking_fields": true,
        "food_code": true,
        "hard_validation": true,
        "household_portion_auditability": true
      },
      "dataset_hash": "0c837864750b30d97f545010c763f2540086d545922b515923c684cae57b66ac",
      "medium_human_score": 5,
      "pseudonym": "chen-food-data-admin",
      "role": "food_composition_data_steward",
      "rubric_version": "phase02-rubric.v1"
    },
    {
      "case_id": "phase02-008",
      "code_eval_hash": "7cb6a35291e1204ecf9ee5f6fa19ebbb27d457e02b7814afd0100f05b8801ebf",